{
  "protocol": "helios.build.worker-profile/v1",
  "profile_id": "kimi-builder-v1",
  "worker_id": "kimi",
  "display_name": "Kimi Impact and Data Builder",
  "roles": ["BUILDER", "REVIEWER"],
  "transports": ["LOCAL_ADAPTER", "EXTERNAL_SESSION"],
  "adapter_protocol": "helios.build.worker-handoff/v1",
  "skills": [],
  "plugins": [],
  "allowed_tools": ["repository-read", "repository-write", "focused-test", "review"],
  "allowed_data_classes": ["REPOSITORY", "BUILD_CONTROL_SANITIZED"],
  "allowed_task_purposes": ["IMPACT_ANALYSIS", "BOUNDED_IMPLEMENTATION", "INDEPENDENT_REVIEW"],
  "authority_limits": [
    "Repository writes require assignment as sole builder",
    "No self-review, integration, commit, push, pull-request, or merge authority",
    "No P0, P1A, runtime database, or bid authority"
  ],
  "max_concurrency": 1
}
