{
  "protocol": "helios.build.worker-profile/v1",
  "profile_id": "claude-builder-v1",
  "worker_id": "claude",
  "display_name": "Claude Architecture Builder and Reviewer",
  "roles": ["ARCHITECT", "BUILDER", "REVIEWER"],
  "transports": ["LOCAL_ADAPTER", "EXTERNAL_SESSION"],
  "adapter_protocol": "helios.build.worker-handoff/v1",
  "skills": [],
  "plugins": [],
  "allowed_tools": ["repository-read", "repository-write", "focused-test", "review"],
  "allowed_data_classes": ["REPOSITORY", "BUILD_CONTROL_SANITIZED"],
  "allowed_task_purposes": ["ARCHITECTURE", "COMPLEX_IMPLEMENTATION", "INDEPENDENT_REVIEW"],
  "authority_limits": [
    "No integration, commit, push, pull-request, or merge authority",
    "Cannot approve its own work",
    "No P0, P1A, runtime database, or bid authority"
  ],
  "max_concurrency": 1
}
