{
  "protocol": "helios.build.worker-profile/v1",
  "profile_id": "codex-control-v1",
  "worker_id": "codex",
  "display_name": "Codex Build Controller and Integrator",
  "roles": ["CONTROLLER", "INTEGRATOR"],
  "transports": ["EXTERNAL_SESSION"],
  "adapter_protocol": null,
  "skills": [],
  "plugins": [],
  "allowed_tools": ["repository-read", "task-control", "graph-control", "integration", "git"],
  "allowed_data_classes": ["REPOSITORY", "BUILD_CONTROL_SANITIZED"],
  "allowed_task_purposes": ["CONTROL", "INTEGRATION"],
  "authority_limits": [
    "No builder or reviewer role",
    "No P0, P1A, runtime database, or bid authority",
    "Integration requires a distinct accepted review"
  ],
  "max_concurrency": 1
}
